{
  "id": "source-hacienda-autonomic-2025",
  "title": "Tributación Autonómica. Medidas 2025 — Capítulo IV",
  "publisher": "Ministerio de Hacienda",
  "url": "https://www.hacienda.gob.es/sgfal/financiacionterritorial/autonomica/capitulo-iv-tributacion-autonomica-2025.pdf",
  "publishedOrUpdatedAt": "2026-04-29",
  "lastReviewedAt": "2026-07-13",
  "sourceType": "official_compendium",
  "notes": "Compendio oficial revisado para las escalas y mínimos autonómicos vigentes en 2025. No demuestra por sí solo que los parámetros permanezcan vigentes en 2027."
}

