{
  "id": "source-synthetic-demo-methodology",
  "title": "Metodología interna de escenarios sintéticos DEMO",
  "publisher": "Cifra Cívica",
  "url": "https://github.com/zetii21/cifra-civica/tree/main/policy-registry/methodology",
  "publishedOrUpdatedAt": "2026-07-13",
  "lastReviewedAt": "2026-07-13",
  "sourceType": "synthetic_methodology",
  "notes": "Registro no normativo que documenta que los escenarios DEMO son ejercicios técnicos inventados para probar comparaciones y no propuestas de partidos."
}
