{
  "id": "source-boe-lirpf-consolidated-2026",
  "title": "Ley 35/2006 del IRPF, texto consolidado",
  "publisher": "Agencia Estatal Boletín Oficial del Estado",
  "url": "https://www.boe.es/buscar/act.php?id=BOE-A-2006-20764&p=20260429&tn=1",
  "publishedOrUpdatedAt": "2026-04-29",
  "lastReviewedAt": "2026-07-13",
  "sourceType": "statute",
  "notes": "Referencia de escala estatal, gravamen del ahorro, mínimos personales y familiares, gastos del trabajo y tributación conjunta. El texto consolidado del BOE es informativo; se conservan las referencias a los artículos aplicados."
}

