{
  "id": "source-seg-social-rates-2026",
  "title": "Tipos de cotización del Régimen General — ejercicio 2026",
  "publisher": "Tesorería General de la Seguridad Social",
  "url": "https://www.seg-social.es/wps/portal/wss/internet/Trabajadores/CotizacionRecaudacionTrabajadores/10721/10957/9932/4315?changeLanguage=es",
  "publishedOrUpdatedAt": "2026-03-31",
  "lastReviewedAt": "2026-07-13",
  "sourceType": "official_guidance",
  "notes": "Tabla oficial de contraste para contingencias comunes, MEI, desempleo y formación profesional a cargo de la persona trabajadora."
}

