{
  "id": "source-boe-social-security-2026",
  "title": "Orden PJC/297/2026 de cotización a la Seguridad Social",
  "publisher": "Agencia Estatal Boletín Oficial del Estado",
  "url": "https://www.boe.es/eli/es/o/2026/03/30/pjc297/dof/spa",
  "publishedOrUpdatedAt": "2026-03-31",
  "lastReviewedAt": "2026-07-13",
  "sourceType": "statute",
  "notes": "Referencia oficial de bases y tipos de cotización 2026, incluidos MEI, solidaridad y tramos RETA. No se presenta como norma 2027."
}

